{
  "tagline": "Self-hosted project management suite with Gantt charts, agile boards, time tracking and meeting minutes.",
  "description": "OpenProject is a web-based project management application written with Ruby on Rails and Angular, licensed under GPL-3.0. It covers project and portfolio planning, Gantt charts, Kanban and Scrum boards, task tracking, bug tracking, time and cost reporting, wikis, forums and meeting agendas. Integrations include Nextcloud, GitHub and GitLab. You can run the Community edition yourself with Docker or with distribution packages, following the installation guides on the project site. A 14-day cloud trial and a paid Enterprise edition, in cloud or on-premises form, also exist, with extra add-ons and support. The company behind it positions the tool against Jira, MS Project, Monday, Asana and YouTrack. For a team leaving Asana, Trello or Smartsheet, it is the heavier choice: more planning and reporting depth, but also a bigger system to install, update and administer. The documented minimum is 4 GB of RAM on a quad-core CPU, and needs grow with the number of users.",
  "strengths": [
    "Gantt scheduling, Kanban, Scrum and bug tracking in one application",
    "Time tracking, cost reporting and budgeting built in",
    "Integrations with Nextcloud, GitHub and GitLab",
    "Docker and package installs documented for the Community edition",
    "Meeting agendas and minutes alongside tasks"
  ],
  "limits": [
    "Full baseline comparison against any date, LDAP group synchronisation and OpenID Connect single sign-on are Enterprise add-ons, not in the free Community edition",
    "The documented minimum for one server is a quad-core CPU, 4 GB of RAM and 20 GB of disk, for up to 200 users",
    "Hosted use means the paid cloud or Enterprise offer; the free trial lasts 14 days"
  ],
  "bestFor": "A team of a few dozen that needs Gantt planning and time tracking and has someone able to run a Rails app."
}
